{
  "$schema": "../../spec/schemas/public-proof-maintenance.schema.json",
  "schema": "neosmartui/public-proof-maintenance@1",
  "component": "core.tabs",
  "trackingIssue": "https://github.com/neosmartui/neosmartui/issues/87",
  "proofRecord": {
    "path": "evidence/public/core.tabs.json",
    "blobSha": "1176b5450fc9100a1ec885a669fad381b9b1e148"
  },
  "implementationFiles": [
    {
      "path": "packages/adapters/web/components/tabs.css",
      "provenBlobSha": "af66b4901193ed49512cac34211d60bc8c10b4f4"
    }
  ]
}
