{
  "$schema": "../../spec/schemas/public-proof-maintenance.schema.json",
  "schema": "neosmartui/public-proof-maintenance@1",
  "component": "core.checkbox",
  "trackingIssue": "https://github.com/neosmartui/neosmartui/issues/87",
  "proofRecord": {
    "path": "evidence/public/core.checkbox.json",
    "blobSha": "ec3fab805d6ba088593cfd66a0544b217a87f889"
  },
  "implementationFiles": [
    {
      "path": "packages/adapters/web/components/checkbox.css",
      "provenBlobSha": "5d2d21868a7bcb16e28391d1163694fdc40b1fbc"
    }
  ]
}
