{
  "$schema": "../../spec/schemas/public-proof-maintenance.schema.json",
  "schema": "neosmartui/public-proof-maintenance@1",
  "component": "core.radio",
  "trackingIssue": "https://github.com/neosmartui/neosmartui/issues/87",
  "proofRecord": {
    "path": "evidence/public/core.radio.json",
    "blobSha": "eadf249706a53ec618591cb3a6b3d4ec077720dd"
  },
  "implementationFiles": [
    {
      "path": "packages/adapters/web/components/radio.css",
      "provenBlobSha": "e537f101a4a624fa27ad0c06d642e6c8b56a4311"
    }
  ]
}
