{
  "$schema": "../../spec/schemas/public-proof-maintenance.schema.json",
  "schema": "neosmartui/public-proof-maintenance@1",
  "component": "core.pagination",
  "trackingIssue": "https://github.com/neosmartui/neosmartui/issues/87",
  "proofRecord": {
    "path": "evidence/public/core.pagination.json",
    "blobSha": "19693312315b53ac85641cbde263db512a3319b8"
  },
  "implementationFiles": [
    {
      "path": "packages/adapters/web/components/pagination.css",
      "provenBlobSha": "998c8776f14cf509b1833fe4f978b5aee7eaa848"
    }
  ]
}
