{
  "$schema": "../../spec/schemas/public-proof-maintenance.schema.json",
  "schema": "neosmartui/public-proof-maintenance@1",
  "component": "core.accordion",
  "trackingIssue": "https://github.com/neosmartui/neosmartui/issues/87",
  "proofRecord": {
    "path": "evidence/public/core.accordion.json",
    "blobSha": "34ef63057ba2b36e73b59b703a18343bfa792aec"
  },
  "implementationFiles": [
    {
      "path": "packages/adapters/web/components/accordion.css",
      "provenBlobSha": "e0d494ff63973bd39d6815583f643e01b394ffe1"
    }
  ]
}
