{
  "$schema": "../../spec/schemas/public-proof-maintenance.schema.json",
  "schema": "neosmartui/public-proof-maintenance@1",
  "flavor": "flavor.hardline",
  "trackingIssue": "https://github.com/neosmartui/neosmartui/issues/84",
  "proofRecord": {
    "path": "evidence/public/flavor.hardline.json",
    "blobSha": "7c58f3f6e92d2a88e0332d2f3c00a9e0d8ea48c4"
  },
  "implementationFiles": [
    {
      "path": "packages/themes/hardline-dark/tokens.json",
      "provenBlobSha": "83a3e09318cacd832ec98ac3f0e5940efcae73e9"
    }
  ]
}
