{
  "$schema": "../../spec/schemas/public-proof-maintenance.schema.json",
  "schema": "neosmartui/public-proof-maintenance@1",
  "component": "core.button",
  "trackingIssue": "https://github.com/neosmartui/neosmartui/issues/87",
  "proofRecord": {
    "path": "evidence/public/core.button.json",
    "blobSha": "86c734486795770c9af00f8709e6154c0c167456"
  },
  "implementationFiles": [
    {
      "path": "packages/adapters/web/components/button.css",
      "provenBlobSha": "821c70154173a536de3ff8b1eeb08f8cdeec1303"
    }
  ]
}
