{
  "$schema": "../../spec/schemas/public-proof-maintenance.schema.json",
  "schema": "neosmartui/public-proof-maintenance@1",
  "component": "core.segmented-control",
  "trackingIssue": "https://github.com/neosmartui/neosmartui/issues/87",
  "proofRecord": {
    "path": "evidence/public/core.segmented-control.json",
    "blobSha": "6f886b44f52458cb550e29c4118a69b7b0568350"
  },
  "implementationFiles": [
    {
      "path": "packages/adapters/web/components/segmented-control.css",
      "provenBlobSha": "b1f99072569be9b4a093e56ac29e9234454855ee"
    }
  ]
}
